{
  "$schema": "https://seuraphotos.app/schema/edit/1.0.json",
  "format": "seura-edit",
  "formatVersion": "1.0",
  "writer": { "app": "Seura Photos", "version": "1.0.0" },
  "modified": "2026-10-17T19:40:12Z",
  "photo": {
    "file": "IMG_1234.jpg",
    "size": 3482113,
    "sha256": "9f2c4e7a1b3d5f60718293a4b5c6d7e8f90a1b2c3d4e5f60718293a4b5c6d7e8",
    "width": 4032,
    "height": 3024
  },
  "operations": [
    { "id": "seura.orient", "version": 1, "params": { "rotate": 90, "flipH": false, "flipV": false } },
    { "id": "seura.crop", "version": 1, "params": { "x": 0.05, "y": 0.1, "width": 0.9, "height": 0.75, "aspect": "4:3" } },
    { "id": "seura.exposure", "version": 1, "params": { "ev": 0.3 } },
    { "id": "seura.whiteBalance", "version": 1, "params": { "temperature": 0, "tint": 5 } },
    { "id": "seura.contrast", "version": 1, "params": { "amount": 35 } },
    { "id": "seura.vignette", "version": 1, "params": { "amount": -25, "size": 60 } },
    { "id": "com.example.filmGrain", "version": 2, "group": "effects", "params": { "amount": 12 } }
  ],
  "tags": ["family/kids", "vacation/2026"],
  "rating": 4,
  "history": [
    { "at": "2026-10-17T19:36:40Z", "label": "Rotate right", "changes": [ { "op": "seura.orient", "from": null, "to": { "rotate": 90, "flipH": false, "flipV": false } } ] },
    { "at": "2026-10-17T19:37:05Z", "label": "Crop", "changes": [ { "op": "seura.crop", "from": null, "to": { "x": 0.05, "y": 0.1, "width": 0.9, "height": 0.75, "aspect": "4:3" } } ] },
    { "at": "2026-10-17T19:37:30Z", "label": "Exposure", "changes": [ { "op": "seura.exposure", "from": null, "to": { "ev": 0.3 } } ] },
    { "at": "2026-10-17T19:38:02Z", "label": "Contrast", "changes": [ { "op": "seura.contrast", "from": null, "to": { "amount": 20 } } ] },
    { "at": "2026-10-17T19:39:15Z", "label": "Tint", "changes": [ { "op": "seura.whiteBalance", "from": null, "to": { "temperature": 0, "tint": 5 } } ] },
    { "at": "2026-10-17T19:39:40Z", "label": "Vignette", "changes": [ { "op": "seura.vignette", "from": null, "to": { "amount": -25, "size": 60 } } ] },
    { "at": "2026-10-17T19:39:52Z", "label": "Add tags", "changes": [ { "field": "tags", "from": [], "to": ["family/kids", "vacation/2026"] } ] },
    { "at": "2026-10-17T19:40:01Z", "label": "Rating", "changes": [ { "field": "rating", "from": 0, "to": 4 } ] },
    { "at": "2026-10-17T19:40:12Z", "label": "Contrast", "changes": [ { "op": "seura.contrast", "from": { "amount": 20 }, "to": { "amount": 35 } } ] }
  ]
}
