{
  "format": "seura-edit",
  "formatVersion": "1.0",
  "photo": {
    "file": "a.jpg",
    "size": 10,
    "sha256": "4e1c0b9a77d3f2e85a6b4c3d2e1f0a9b8c7d6e5f4a3b2c1d0e9f8a7b6c5d4e3f",
    "width": 10,
    "height": 10
  },
  "operations": [
    {
      "id": "seura.redEye",
      "version": 1,
      "params": {
        "regions": [
          {
            "x": 0.1,
            "y": 0.1,
            "radius": 0.01
          },
          {
            "x": 0.2143,
            "y": 0.1,
            "radius": 0.01
          },
          {
            "x": 0.3286,
            "y": 0.1,
            "radius": 0.01
          },
          {
            "x": 0.4429,
            "y": 0.1,
            "radius": 0.01
          },
          {
            "x": 0.5571,
            "y": 0.1,
            "radius": 0.01
          },
          {
            "x": 0.6714,
            "y": 0.1,
            "radius": 0.01
          },
          {
            "x": 0.7857,
            "y": 0.1,
            "radius": 0.01
          },
          {
            "x": 0.9,
            "y": 0.1,
            "radius": 0.01
          },
          {
            "x": 0.1,
            "y": 0.2,
            "radius": 0.01
          },
          {
            "x": 0.2143,
            "y": 0.2,
            "radius": 0.01
          },
          {
            "x": 0.3286,
            "y": 0.2,
            "radius": 0.01
          },
          {
            "x": 0.4429,
            "y": 0.2,
            "radius": 0.01
          },
          {
            "x": 0.5571,
            "y": 0.2,
            "radius": 0.01
          },
          {
            "x": 0.6714,
            "y": 0.2,
            "radius": 0.01
          },
          {
            "x": 0.7857,
            "y": 0.2,
            "radius": 0.01
          },
          {
            "x": 0.9,
            "y": 0.2,
            "radius": 0.01
          },
          {
            "x": 0.1,
            "y": 0.3,
            "radius": 0.01
          },
          {
            "x": 0.2143,
            "y": 0.3,
            "radius": 0.01
          },
          {
            "x": 0.3286,
            "y": 0.3,
            "radius": 0.01
          },
          {
            "x": 0.4429,
            "y": 0.3,
            "radius": 0.01
          },
          {
            "x": 0.5571,
            "y": 0.3,
            "radius": 0.01
          },
          {
            "x": 0.6714,
            "y": 0.3,
            "radius": 0.01
          },
          {
            "x": 0.7857,
            "y": 0.3,
            "radius": 0.01
          },
          {
            "x": 0.9,
            "y": 0.3,
            "radius": 0.01
          },
          {
            "x": 0.1,
            "y": 0.4,
            "radius": 0.01
          },
          {
            "x": 0.2143,
            "y": 0.4,
            "radius": 0.01
          },
          {
            "x": 0.3286,
            "y": 0.4,
            "radius": 0.01
          },
          {
            "x": 0.4429,
            "y": 0.4,
            "radius": 0.01
          },
          {
            "x": 0.5571,
            "y": 0.4,
            "radius": 0.01
          },
          {
            "x": 0.6714,
            "y": 0.4,
            "radius": 0.01
          },
          {
            "x": 0.7857,
            "y": 0.4,
            "radius": 0.01
          },
          {
            "x": 0.9,
            "y": 0.4,
            "radius": 0.01
          },
          {
            "x": 0.1,
            "y": 0.5,
            "radius": 0.01
          },
          {
            "x": 0.2143,
            "y": 0.5,
            "radius": 0.01
          },
          {
            "x": 0.3286,
            "y": 0.5,
            "radius": 0.01
          },
          {
            "x": 0.4429,
            "y": 0.5,
            "radius": 0.01
          },
          {
            "x": 0.5571,
            "y": 0.5,
            "radius": 0.01
          },
          {
            "x": 0.6714,
            "y": 0.5,
            "radius": 0.01
          },
          {
            "x": 0.7857,
            "y": 0.5,
            "radius": 0.01
          },
          {
            "x": 0.9,
            "y": 0.5,
            "radius": 0.01
          },
          {
            "x": 0.1,
            "y": 0.6,
            "radius": 0.01
          },
          {
            "x": 0.2143,
            "y": 0.6,
            "radius": 0.01
          },
          {
            "x": 0.3286,
            "y": 0.6,
            "radius": 0.01
          },
          {
            "x": 0.4429,
            "y": 0.6,
            "radius": 0.01
          },
          {
            "x": 0.5571,
            "y": 0.6,
            "radius": 0.01
          },
          {
            "x": 0.6714,
            "y": 0.6,
            "radius": 0.01
          },
          {
            "x": 0.7857,
            "y": 0.6,
            "radius": 0.01
          },
          {
            "x": 0.9,
            "y": 0.6,
            "radius": 0.01
          },
          {
            "x": 0.1,
            "y": 0.7,
            "radius": 0.01
          },
          {
            "x": 0.2143,
            "y": 0.7,
            "radius": 0.01
          },
          {
            "x": 0.3286,
            "y": 0.7,
            "radius": 0.01
          },
          {
            "x": 0.4429,
            "y": 0.7,
            "radius": 0.01
          },
          {
            "x": 0.5571,
            "y": 0.7,
            "radius": 0.01
          },
          {
            "x": 0.6714,
            "y": 0.7,
            "radius": 0.01
          },
          {
            "x": 0.7857,
            "y": 0.7,
            "radius": 0.01
          },
          {
            "x": 0.9,
            "y": 0.7,
            "radius": 0.01
          },
          {
            "x": 0.1,
            "y": 0.8,
            "radius": 0.01
          },
          {
            "x": 0.2143,
            "y": 0.8,
            "radius": 0.01
          },
          {
            "x": 0.3286,
            "y": 0.8,
            "radius": 0.01
          },
          {
            "x": 0.4429,
            "y": 0.8,
            "radius": 0.01
          },
          {
            "x": 0.5571,
            "y": 0.8,
            "radius": 0.01
          },
          {
            "x": 0.6714,
            "y": 0.8,
            "radius": 0.01
          },
          {
            "x": 0.7857,
            "y": 0.8,
            "radius": 0.01
          },
          {
            "x": 0.9,
            "y": 0.8,
            "radius": 0.01
          }
        ]
      }
    }
  ]
}
